{
  "$schema": "../../schema-json/people.schema.json",
  "givenNames": [
    "Ysolde",
    "Rendell",
    "Maren",
    "Tobiah",
    "Anouk",
    "Caspar",
    "Ifeoma",
    "Lio",
    "Petra",
    "Hamid",
    "Juno",
    "Oskar",
    "Saoirse",
    "Teodor",
    "Wren",
    "Adaeze",
    "Bram",
    "Ines",
    "Emeric",
    "Halla"
  ],
  "familyNames": [
    "Maren",
    "Okafor",
    "Vance",
    "Lindqvist",
    "Castellanos",
    "Achterberg",
    "Nakamura-Reyes",
    "Duarte",
    "Farrow",
    "Iyer",
    "Kowalczyk",
    "Mbeki",
    "Ortega",
    "Rask",
    "Sadler",
    "Thorne",
    "Ueda",
    "Whitlock"
  ],
  "pitches": [
    "I've got {cargo} sitting on my dock and a buyer in {to} who keeps asking where it is.",
    "Nothing clever about this one: {cargo} from {from} to {to}, handled like you mean it.",
    "You look like a crew that shows up where they say they will. I need that for {to}.",
    "My usual hauler went quiet a week ago. I'd rather not find out why the hard way.",
    "It's {cargo} for {to}. Keep it dry, keep it upright, and we'll get along fine."
  ],
  "cargoWords": {
    "general": "general freight",
    "fragile": "fragile equipment",
    "perishable": "fresh produce",
    "hazardous": "hazardous cargo"
  },
  "ports": {
    "port.crossroads_hub": {
      "roles": ["freight broker", "berth agent", "transfer clerk", "dispatcher"],
      "orgs": ["Crossroads Logistics Co-op", "Meridian Trading House", "Hub Transfer Office"],
      "pitches": [
        "Three lanes meet here and every one of them is running late. Yours doesn't have to be.",
        "I've had this manifest on my screen all shift. Take it off my hands?"
      ]
    },
    "port.kessler_drift": {
      "roles": ["shift foreman", "assay clerk", "fabrication lead", "ore-dock boss"],
      "orgs": ["Kessler Drift Mining Guild", "Drift Fabrication Shop", "Drift Assay Office"],
      "pitches": [
        "The ore haulers won't touch anything that isn't ore. You're not an ore hauler.",
        "Packed it myself. If it arrives in {to} the way it left here, I'll remember your ship."
      ]
    },
    "port.green_meridian": {
      "roles": ["grower", "silo keeper", "co-op steward", "seed-bank archivist"],
      "orgs": ["Meridian Growers Collective", "Green Meridian Cooperative", "Meridian Seed Bank"],
      "pitches": [
        "This lot was picked this morning. It won't wait for the next quiet ship.",
        "We grow it slow out here. Getting it to {to} is the part we can't do ourselves."
      ]
    },
    "port.ossory_station": {
      "roles": ["yard boss", "claims registrar", "breaker", "scrap buyer"],
      "orgs": ["Ossory Breakers' Association", "Ossory Claims Registry", "Orlov Cutting Yard"],
      "pitches": [
        "We cut up more ships than dock here. Someone has to carry the pieces out.",
        "Estate's settled, claim's sold, and the {cargo} goes to {to}. Don't ask whose it was."
      ]
    },
    "port.vesper_gate": {
      "roles": ["hospice warden", "dock keeper", "physician", "chaplain"],
      "orgs": ["Vesper Gate Hospice", "Order of the Long Gallery", "Gate Dispensary"],
      "pitches": [
        "We make these for the sick. Get them to {to} and someone will be glad you did.",
        "People come here to say goodbye. Most of them need a ship home afterwards."
      ]
    },
    "port.terns_rest": {
      "roles": ["marshal", "relay operator", "homesteader", "trading-post keeper"],
      "orgs": ["Tern's Rest Relay", "Harrow's Trading Post", "Rest Homesteaders' Council"],
      "pitches": [
        "Nobody comes out this far by accident. Since you're here, take this to {to}.",
        "Out here a ship that comes back twice is news. Be news."
      ]
    }
  }
}
